{
  "schema": "codex-scientiae/acquisition/0.1",
  "state": "acquired",
  "slug": "2408.16741v2",
  "artifact": {
    "provider": "arxiv",
    "identifier": "2408.16741v2",
    "provider_roles": [
      "artifact-origin",
      "artifact-access",
      "metadata-authority"
    ]
  },
  "forms": [
    {
      "kind": "source",
      "path": "arXiv-2408.16741v2.tar.gz",
      "format": "application/gzip",
      "bytes": 421680,
      "sha256": "535dbdc5dbe609a2dc4bb4cde03c20add78a9ed134854bdff35434b607fe39c7",
      "custody": "provider-download",
      "origin_url": "https://arxiv.org/src/2408.16741v2",
      "candidate_id": "arxiv-source",
      "fetched_at": "2026-09-01T04:44:18.579794Z",
      "provider_checksum": null,
      "local_import": null
    },
    {
      "kind": "pdf",
      "path": "2408.16741v2.pdf",
      "format": "application/pdf",
      "bytes": 938485,
      "sha256": "343e6c6e076ce0a2d0022f45fab35c0741dcde0c7af795f5d253b4640296c483",
      "custody": "adopted",
      "origin_url": null,
      "candidate_id": null,
      "fetched_at": null,
      "provider_checksum": null,
      "local_import": null
    }
  ]
}
